{
  "schema_version": "1.0",
  "project": {
    "id": "PRJ-PPT-EVAL-001",
    "name": "工业级 PPT 评测与数据飞轮",
    "status": "mvp_implemented_production_validation_pending",
    "as_of": "2026-08-26T18:00:00+08:00",
    "owner": "PPT Evaluation Team",
    "purpose": "以可解释、可降级、可审计的 Agentic Harness 统一评估四类 PPT 任务，并产生受控的数据飞轮信号。",
    "success_definition": "基础质量永不被专项故障吞没；硬门槛高精度；所有结论可沿不可变 ID 回放。"
  },
  "phases": [
    {
      "id": "PHASE-RESEARCH",
      "name": "调研",
      "objective": "证明指标有依据、数据可使用、风险可控。",
      "process": ["复现公开基线", "建立失败分类", "迁移 PPT-PDMS", "预注册数据与门槛"],
      "evidence": ["reports/01_research/01_related_work_matrix.md", "reports/01_research/02_ppt_pdms_migration.md", "reports/01_research/03_failure_taxonomy_and_rubric.md", "reports/01_research/06_baseline_reproduction.md", "reports/01_research/07_public_dataset_catalog.md"],
      "decisions": ["DEC-RESEARCH-001: 乘子按不可补偿性选取", "DEC-RESEARCH-002: 派生样本随父样本分组切分"],
      "gate": {"status": "partial_reproduction", "criteria_total": 5, "criteria_met": 1, "note": "两套基线已固定并跑到公开产物/凭证边界，公开数据目录已完成；exact score、中文金标和法务签字仍待补齐。"},
      "risks": ["公开数据许可不清", "人工偏好存在域差异"]
    },
    {
      "id": "PHASE-DEVELOPMENT",
      "name": "开发",
      "objective": "实现确定性总控、可替换 Oracle 与强制基础质量子图。",
      "process": ["SRS 与 C4", "契约冻结", "纵向切片", "专项 Oracle 与审计流水"],
      "evidence": ["reports/02_development/00_srs.md", "reports/02_development/01_system_design.md", "reports/02_development/04_traceability_matrix.md", "reports/02_development/06_version_matrix_changelog.md", "reports/02_development/99_stage_gate.md"],
      "decisions": ["ADR-001: 模块化单体", "ADR-002: BaselinePptQualityOracle 强制注入", "ADR-003: ERROR 与 FAIL 分离"],
      "gate": {"status": "mvp_passed_review_pending", "criteria_total": 6, "criteria_met": 3, "note": "契约、纵向切片和四场景降级已通过；架构与安全仍待负责人签字。"},
      "risks": ["PowerPoint 与 LibreOffice 渲染差异", "外部 Judge 成本和漂移"]
    },
    {
      "id": "PHASE-EVALUATION",
      "name": "评测",
      "objective": "同时验证 PPT 质量判定与评测器自身可信度。",
      "process": ["组件与契约测试", "变形和降级测试", "人工元评测", "Shadow 与灰度"],
      "evidence": ["reports/03_evaluation/00_preregistration.md", "reports/03_evaluation/01_test_plan.md", "reports/03_evaluation/02_acceptance_and_shadow.md", "reports/03_evaluation/04_mvp_verification.md", "reports/03_evaluation/99_stage_gate.md"],
      "decisions": ["DEC-EVAL-001: 冻结集不用于调参", "DEC-EVAL-002: 门槛看置信上界而非点估计"],
      "gate": {"status": "mvp_verified_production_pending", "criteria_total": 8, "criteria_met": 3, "note": "42项测试、四场景 Smoke 与审计链已通过；人工金标和 Shadow 门槛仍未开始。"},
      "risks": ["高置信拦截样本稀少", "生产分布漂移"]
    }
  ],
  "scenarios": [
    {"id": "SCN-TEXT", "name": "文字生成 PPT", "fallback": "BASE_ONLY", "lambda": 0.55},
    {"id": "SCN-SUMMARY", "name": "项目总结生成", "fallback": "BASE_ONLY", "lambda": 0.40},
    {"id": "SCN-MULTIMODAL", "name": "多模态生成", "fallback": "BASE_ONLY", "lambda": 0.45},
    {"id": "SCN-READY", "name": "成品 PPT", "fallback": "BASE_ONLY", "lambda": 1.00}
  ],
  "formula": {
    "base": "100 * product(M_base) * A_base",
    "full": "100 * product(M_base) * product(M_scene) * [lambda*A_base + (1-lambda)*A_scene]",
    "multipliers": [0, 0.5, 1],
    "rule": "同一缺陷不得同时进入乘算和加算；ERROR 不计零分。"
  },
  "acceptance_targets": [
    {"metric": "human_objective_alpha", "operator": ">=", "target": 0.80, "status": "planned"},
    {"metric": "human_pairwise_agreement", "operator": ">=", "target": 0.80, "status": "planned"},
    {"metric": "high_confidence_block_precision", "operator": ">=", "target": 0.98, "status": "planned"},
    {"metric": "severe_escape_rate_upper_95", "operator": "<", "target": 0.01, "status": "planned"},
    {"metric": "gate_repeatability", "operator": ">=", "target": 0.99, "status": "planned"}
  ],
  "traceability": [
    {"requirement": "REQ-BASE-001", "decision": "ADR-002", "oracle": "ORC-BASE-001", "test": "TST-MVP-001", "experiment": "EXP-MVP-FOUR-SCENES-001", "release": "REL-PENDING"},
    {"requirement": "REQ-SCORE-001", "decision": "ADR-004", "oracle": "ORC-AGG-001", "test": "TST-MVP-001", "experiment": "EXP-CAL-001", "release": "REL-PENDING"},
    {"requirement": "REQ-AUDIT-001", "decision": "ADR-006", "oracle": "ORC-N/A", "test": "TST-MVP-001", "experiment": "EXP-AUDIT-MVP-001", "release": "REL-PENDING"}
  ],
  "run_manifest_example": {
    "run_id": "RUN-DEMO-0001",
    "case_id": "CASE-SYNTH-0001",
    "input_sha256": "aaaaaaaaaaaaaaaaaaaaaaaaaaaaaaaaaaaaaaaaaaaaaaaaaaaaaaaaaaaaaaaa",
    "git_sha": "UNCOMMITTED-DEMO",
    "container_digest": "sha256:demo",
    "font_bundle": "fonts-zh-enterprise-v1",
    "models": {"llm": "adapter/demo", "vlm": "adapter/demo", "ocr": "adapter/demo"},
    "prompt_profile": "prompt-demo-v1",
    "eval_profile": "profile-text-v1",
    "random_seed": 20260826,
    "cost_cny": 0,
    "output_sha256": "bbbbbbbbbbbbbbbbbbbbbbbbbbbbbbbbbbbbbbbbbbbbbbbbbbbbbbbbbbbbbbbb",
    "synthetic": true
  },
  "deck": {
    "title": "让 PPT 评测成为可控的数据飞轮",
    "audience": "技术面试官与评审委员会",
    "takeaway": "确定性 Harness 负责治理，Oracle 负责判断，PPT-PDMS 负责不可补偿性，审计链负责可信复现。",
    "slides": [
      {"chapter": "调研", "title": "先证明问题，再写评测器", "claim": "四场景共享本体质量，但证据条件和失败方式不同。", "points": ["任务定义先于指标", "本体质量是强制兜底", "研究门禁阻止无依据权重上线"], "source": "reports/01_research/00_project_charter.md"},
      {"chapter": "调研", "title": "公开基线覆盖局部，工业闭环要求证据链", "claim": "单一 LLM/VLM 总分不能同时解决忠实性、可交付性与审计。", "points": ["比较指标覆盖与攻击面", "保留 PPTX 结构证据", "把人工上限作为校准参照"], "source": "reports/01_research/01_related_work_matrix.md"},
      {"chapter": "调研", "title": "PPT-PDMS 把不可补偿缺陷放在公式外层", "claim": "少量高置信硬错误相乘，其他性能在内层加权。", "points": ["乘子仅取 0/0.5/1", "禁止同缺陷双罚", "ERROR 与质量失败分离"], "source": "reports/01_research/02_ppt_pdms_migration.md"},
      {"chapter": "开发", "title": "确定性总控不需要知道指标怎么打分", "claim": "Supervisor 只调度节点、预算和状态，判断封装在 Oracle。", "points": ["OBSERVE→PLAN→ACT→VERIFY", "Composite/Leaf Oracle", "Adapter 隔离供应商"], "source": "reports/02_development/01_system_design.md"},
      {"chapter": "开发", "title": "基础质量子图是编译期不变量", "claim": "任何专项缺失或失败，都保留可解释的 S_base。", "points": ["ProfileCompiler 强制注入", "FULL/DEGRADED/BASE_ONLY", "UNASSESSABLE 仅限文件不可解析"], "source": "reports/02_development/00_srs.md"},
      {"chapter": "开发", "title": "契约和审计让替换模型不改上层", "claim": "统一 OracleResult、版本指纹和事件流支撑回放。", "points": ["严格状态语义", "不可变证据定位", "REQ→ADR→TEST→RUN"], "source": "reports/02_development/04_traceability_matrix.md"},
      {"chapter": "评测", "title": "评测系统也必须被评测", "claim": "组件正确不等于 Judge 可信，必须加入人工元评测。", "points": ["α/ICC 与排序相关", "Brier/ECE 校准", "定位 F1 与重复稳定性"], "source": "reports/03_evaluation/00_preregistration.md"},
      {"chapter": "评测", "title": "42项测试验证兜底和评分边界", "claim": "四场景 Smoke 证明专项故障不会吞掉本体报告或伪造完整分。", "points": ["42 passed / 0 failed", "FULL 与 DEGRADED 均有真实 Run", "哈希链与人工复核可回放"], "source": "reports/03_evaluation/04_mvp_verification.md"},
      {"chapter": "评测", "title": "飞轮只提候选，生产发布仍由人治理", "claim": "生产反馈进入工作池，经冻结集、Shadow 和审批后演进。", "points": ["主动采样+随机样本", "两周或 1000 份 Shadow", "5%→25%→100% 灰度"], "source": "reports/03_evaluation/02_acceptance_and_shadow.md"}
    ]
  }
}
